#,Keyword,Country,Difficulty,Volume,CPC,CPS,Parent Keyword,Last Update,SERP Features,Global volume,Traffic potential
1,electric razors for men,us,,800,1.00,1.25,,,,800,
2,razors for men,us,,150,4.50,1.1,,,,150,
3,best razors for men,us,,150,4.50,1.44,,,,150,
4,electric razors for men reviews,us,,90,1.10,,,,,90,
5,safety razors for men,us,,30,4.50,,,,,30,
6,single blade razors for men,us,,20,1.90,,,,,20,
7,best electric razors for men 2019,us,,20,,,,,,20,
8,best electric razors for men,us,,20,0.70,,,,,20,
9,walmart electric razors for men,us,,20,1.10,,,,,20,
10,remington electric razors for men,us,,10,1.50,,,,,10,
11,shaving razors for men,us,,10,4.00,,,,,10,
12,razors for men for free,us,,,,,,,,,
13,compare razors for men,us,,,,,,,,,
14,brett favre razors for men,us,,,,,,,,,
15,5 blade razors for men,us,,,,,,,,,
16,wahl razors for men,us,,,,,,,,,
17,best safety razors for men,us,,,1.30,,,,,,
18,best rated razors for men,us,,,,,,,,,
19,best razors for black men,us,,,4.00,,,,,,
20,body razors for men,us,,,,,,,,,
21,viking razors for men,us,,,,,,,,,
22,razors for bald men,us,,,0.80,,,,,,
23,norelco razors for men,us,,,1.20,,,,,,
24,norelco razors 4500 for men at amazon,us,,,,,,,,,
25,razors for men walmart,us,,,,,,,,,
26,best razors for razor men,us,,,,,,,,,
27,schick injector razors for men stick,us,,,,,,,,,
28,gillette razors for men,us,,,1.00,,,,,,
29,remington razors for men,us,,,1.00,,,,,,
30,schick injector razors for men,us,,,,,,,,,
31,twin blade razors for men,us,,,,,,,,,
32,electric razors for men walmart,us,,,0.35,,,,,,
33,types of razors for men,us,,,,,,,,,
34,head razors for men,us,,,,,,,,,
35,philips wet dry electric razors for men,us,,,,,,,,,
36,ratings of electric razors for men,us,,,,,,,,,
37,men need to pay for there razors like women and there tampons,us,,,,,,,,,
38,electric razors for men reviews 2016 corded,us,,,,,,,,,
39,best electric razors for men 2015,us,,,,,,,,,
40,show me all bic razors for men,us,,,,,,,,,
41,schick disposable razors for men,us,,,3.50,,,,,,
42,gillette disposable razors for men,us,,,1.10,,,,,,
43,highest rated electric razors for men,us,,,,,,,,,
44,amazon electric razors for men,us,,,,,,,,,
45,new electric razors for men,us,,,,,,,,,
46,quality razors for men,us,,,,,,,,,
47,philips electric razors for men,us,,,,,,,,,
48,luxury razors for men,us,,,,,,,,,
49,kohl's electric razors for men,us,,,,,,,,,
50,norelco razors for men at besbuy,us,,,,,,,,,
51,as seen on tv razors for men,us,,,,,,,,,
52,best quality razors for men,us,,,,,,,,,
53,best electric razors for men 2018,us,,,,,,,,,
54,battery powered razors for men,us,,,,,,,,,
55,amazon best electric razors for men 2018,us,,,,,,,,,
56,mail order razors for men,us,,,,,,,,,
57,schick injector razors for men handle,us,,,,,,,,,
58,best razors for men of color,us,,,,,,,,,
59,wahl electric razors for men,us,,,,,,,,,
60,braun electric razors for men,us,,,0.70,,,,,,
61,gillette electric razors for men,us,,,,,,,,,
62,razors for sensitive skin for men,us,,,,,,,,,
63,norelco electric razors for men,us,,,,,,,,,
64,henry's razors for men,us,,,,,,,,,
65,best hair razors for men,us,,,,,,,,,
66,best inexpensive razors for men,us,,,,,,,,,
67,pace razors for men,us,,,,,,,,,
68,norelco razors for men ebay,us,,,,,,,,,
69,new razors for men,us,,,5.00,,,,,,
70,best cheap razors for men,us,,,3.00,,,,,,
71,mobil electric razors for men,us,,,,,,,,,
72,electric razors for men shick,us,,,,,,,,,
73,walmart electric razors triple head for men,us,,,,,,,,,
74,shaving razors for men companies,us,,,,,,,,,
75,back razors for men,us,,,,,,,,,
76,good razors for men,us,,,7.00,,,,,,
77,lazer razors for men,us,,,,,,,,,
78,best razors for men with curly hair,us,,,,,,,,,
79,good razors for black men,us,,,,,,,,,
80,best razors for men consumersearch,us,,,,,,,,,
81,adjustable razors for men,us,,,,,,,,,
82,philips razors for men,us,,,,,,,,,
83,gillette atra razors for men,us,,,,,,,,,
84,travel razors for men,us,,,,,,,,,
85,old time razors for men,us,,,,,,,,,
86,brands of razors for men,us,,,,,,,,,
87,adjustable razors for men review,us,,,,,,,,,
88,double blade razors for men,us,,,,,,,,,
89,best cordless razors for men,us,,,0.45,,,,,,
90,fixed twin blade razors for men,us,,,,,,,,,
91,walgreens electric razors for men,us,,,,,,,,,
92,mergress safety razors for men,us,,,,,,,,,
93,buzzfeed men try womens razors for the first time,us,,,,,,,,,
94,1800 razors for men,us,,,,,,,,,
95,panasonic razors for men,us,,,0.45,,,,,,
96,electric razors for men that work,us,,,,,,,,,
97,electric razors for men reviews and prices,us,,,,,,,,,
98,gillette sensor 2 razors for men,us,,,,,,,,,
99,norelco razors 4500 for men at besbuy,us,,,,,,,,,
100,wilkinson sword disposable razors for men,us,,,,,,,,,
101,best quality razors for men amazon,us,,,,,,,,,
102,remington electric razors for men-da-307,us,,,,,,,,,
103,electric razors for men with lotion,us,,,,,,,,,
104,adjustable safety razors for men,us,,,,,,,,,
105,electric razors at kmart for men,us,,,,,,,,,
106,single blade razors for black men,us,,,,,,,,,
107,2 blade razors for men,us,,,,,,,,,
108,top 5 razors for men,us,,,,,,,,,
109,razors for black men bumps,us,,,,,,,,,
110,battery operated razors for men,us,,,,,,,,,
111,where can you buy a gillette safety razors for men,us,,,,,,,,,
112,adjustable electric razors for men,us,,,,,,,,,
113,best electric razors for men reviews,us,,,,,,,,,
114,straight razors for men,us,,,0.45,,,,,,
115,the best electric razors for men,us,,,4.00,,,,,,
116,eletric razors for men,us,,,,,,,,,
117,razors for men electric,us,,,,,,,,,
118,top electric razors for men,us,,,0.40,,,,,,
119,best razors for bald black men,us,,,,,,,,,
120,skarp laser razors for men,us,,,,,,,,,
121,schick quattro razors for men,us,,,4.50,,,,,,
122,costco electric razors for men,us,,,,,,,,,
123,bic razors for men,us,,,1.90,,,,,,
124,top razors for men,us,,,3.00,,,,,,
125,rechargeable razors for men,us,,,,,,,,,
126,schick razors for men amazon,us,,,,,,,,,
127,we still make razors for men,us,,,,,,,,,
128,walmart razors for black men,us,,,,,,,,,
129,black friday razors for men,us,,,,,,,,,
130,coupons for razors for men,us,,,,,,,,,
131,gillette sensor razors for men,us,,,,,,,,,
132,"electric razor for men,flyco electric shavers 2 in 1 mens wet & dry electric razors",us,,,,,,,,,
133,cheap electric razors for men,us,,,,,,,,,
134,schick razors for men,us,,,0.50,,,,,,
